{
  "audit_report_schema_version": "1.0",
  "verifier": {
    "name": "voiceover-evidence-bundle-verifier",
    "version": "1.0"
  },
  "checked_at": "2026-10-04T00:00:00Z",
  "bundle_path": "/example/evidence-bundle",
  "manifest_name": "evidence-bundle-manifest-v1.json",
  "status": "FAIL",
  "checks": {
    "manifest_schema": "SEE_ERRORS",
    "file_inventory_and_hashes": "SEE_ERRORS",
    "envelope_payload_binding": "SEE_ERRORS",
    "cryptographic_authenticity": "NOT_ESTABLISHED"
  },
  "error_count": 1,
  "errors": [
    {
      "code": "BUNDLE_FILE_HASH_MISMATCH",
      "category": "integrity",
      "severity": "error",
      "message": "A payload file digest differs from the manifest.",
      "remediation": "Treat the bundle as changed; verify the source independently before regenerating hashes.",
      "raw_message": "SHA-256 mismatch: payload/result.wav"
    }
  ],
  "limitations": [
    "PASS means local bundle consistency only; it does not authenticate the manifest author."
  ]
}
